{
  "snapshotDate": "2026-10-13",
  "methodology": {
    "en": "Repository metadata and languages come from the GitHub REST API; activity and workflow observations come from the generated registry snapshot. Missing values remain null. Evidence rubric criteria require owner approval.",
    "fa": "فراداده و زبان‌های مخزن از API رسمی GitHub دریافت می‌شود؛ داده‌های فعالیت و گردش‌کار از snapshot رجیستری تولیدشده‌اند. دادهٔ ناموجود null می‌ماند. معیارهای روبریک شواهد نیازمند تأیید مالک‌اند."
  },
  "source": {
    "name": "GitHub REST API and repository snapshot",
    "query": "gh api --paginate -X GET user/repos -f affiliation=owner -f per_page=100 --slurp",
    "contentHash": "sha256:d6b34d66fe387acf9799cb2019a5cdac6533902901df010156acbf65a047a826"
  },
  "projects": [
    {
      "id": "apex-dee",
      "name": "Apex Deep Quant",
      "visibility": "public",
      "kind": "original",
      "family": "quantitative-systems",
      "status": "legacy",
      "featured": false,
      "order": 0,
      "description": {
        "en": "An early quantitative systems prototype; lineage remains unclassified.",
        "fa": "نمونهٔ اولیه‌ای در سامانه‌های کمّی؛ تبار آن هنوز طبقه‌بندی نشده است."
      },
      "scope": {
        "summary": {
          "en": null,
          "fa": null
        },
        "limits": {
          "en": [],
          "fa": []
        }
      },
      "stack": [],
      "languages": [
        "HTML",
        "Python"
      ],
      "links": {
        "source": "https://github.com/aixaria0/-Apex-Dee",
        "live": null,
        "docs": null,
        "evidence": null
      },
      "metrics": {
        "commits": 35,
        "prs": 2,
        "mergedPrs": 2,
        "ciRuns": 20,
        "evidence": {
          "score": null,
          "criteria": [
            {
              "id": "criterion-01",
              "met": null,
              "evidenceUrl": null
            },
            {
              "id": "criterion-02",
              "met": null,
              "evidenceUrl": null
            },
            {
              "id": "criterion-03",
              "met": null,
              "evidenceUrl": null
            },
            {
              "id": "criterion-04",
              "met": null,
              "evidenceUrl": null
            },
            {
              "id": "criterion-05",
              "met": null,
              "evidenceUrl": null
            },
            {
              "id": "criterion-06",
              "met": null,
              "evidenceUrl": null
            },
            {
              "id": "criterion-07",
              "met": null,
              "evidenceUrl": null
            },
            {
              "id": "criterion-08",
              "met": null,
              "evidenceUrl": null
            },
            {
              "id": "criterion-09",
              "met": null,
              "evidenceUrl": null
            },
            {
              "id": "criterion-10",
              "met": null,
              "evidenceUrl": null
            },
            {
              "id": "criterion-11",
              "met": null,
              "evidenceUrl": null
            },
            {
              "id": "criterion-12",
              "met": null,
              "evidenceUrl": null
            },
            {
              "id": "criterion-13",
              "met": null,
              "evidenceUrl": null
            },
            {
              "id": "criterion-14",
              "met": null,
              "evidenceUrl": null
            }
          ]
        }
      }
    },
    {
      "id": "aether-runtime",
      "name": "Aether Runtime",
      "visibility": "public",
      "kind": "original",
      "family": "chimera-evidence-runtime",
      "status": "active",
      "featured": true,
      "order": 2,
      "description": {
        "en": "Keep a verifiable record of bounded execution across routing failures, restarts, and replay.",
        "fa": "برای اجرای محدود، هنگام خطای مسیریابی، راه‌اندازی دوباره و بازپخش، سابقه‌ای قابل راستی‌آزمایی نگه می‌دارد."
      },
      "scope": {
        "summary": {
          "en": "A Rust control plane and C++ route share an operation contract. Persisted Ed25519 identities sign execution receipts. Current admitted operations are echo, ASCII uppercase, and sha256.",
          "fa": "بخش کنترلِ نوشته‌شده با راست و مسیر اجراییِ سی‌پلاس‌پلاس، قرارداد عملیات مشترک دارند. هویت‌های پایدار با الگوریتم Ed25519 رسید اجرا را امضا می‌کنند. عملیات پذیرفته‌شدهٔ کنونی فقط بازتاب پیام، تبدیل حروف انگلیسی به بزرگ و محاسبهٔ هش SHA-256 است."
        },
        "limits": {
          "en": [
            "no blanket remote-attestation claim",
            "no distributed-consensus claim",
            "no arbitrary-shell safety claim"
          ],
          "fa": [
            "این کار ادعای گواهی کلی دربارهٔ اجرای راه‌دور ندارد.",
            "این محیط، ادعای اجماع توزیع‌شده ندارد.",
            "ایمنی اجرای فرمان دلخواه در پوسته ادعا نمی‌شود."
          ]
        }
      },
      "stack": [
        "Rust",
        "C++",
        "gRPC",
        "SQLite WAL"
      ],
      "languages": [
        "Rust",
        "Python",
        "HTML",
        "C++",
        "Shell",
        "CMake",
        "Dockerfile"
      ],
      "links": {
        "source": "https://github.com/aixaria0/aether-runtime",
        "live": null,
        "docs": "https://github.com/aixaria0/aether-runtime/blob/main/docs/architecture-decisions.md",
        "evidence": "https://github.com/aixaria0/aether-runtime/blob/main/README.md"
      },
      "metrics": {
        "commits": 53,
        "prs": 12,
        "mergedPrs": 11,
        "ciRuns": 20,
        "evidence": {
          "score": 9,
          "criteria": [
            {
              "id": "criterion-01",
              "met": null,
              "evidenceUrl": null
            },
            {
              "id": "criterion-02",
              "met": null,
              "evidenceUrl": null
            },
            {
              "id": "criterion-03",
              "met": null,
              "evidenceUrl": null
            },
            {
              "id": "criterion-04",
              "met": null,
              "evidenceUrl": null
            },
            {
              "id": "criterion-05",
              "met": null,
              "evidenceUrl": null
            },
            {
              "id": "criterion-06",
              "met": null,
              "evidenceUrl": null
            },
            {
              "id": "criterion-07",
              "met": null,
              "evidenceUrl": null
            },
            {
              "id": "criterion-08",
              "met": null,
              "evidenceUrl": null
            },
            {
              "id": "criterion-09",
              "met": null,
              "evidenceUrl": null
            },
            {
              "id": "criterion-10",
              "met": null,
              "evidenceUrl": null
            },
            {
              "id": "criterion-11",
              "met": null,
              "evidenceUrl": null
            },
            {
              "id": "criterion-12",
              "met": null,
              "evidenceUrl": null
            },
            {
              "id": "criterion-13",
              "met": null,
              "evidenceUrl": null
            },
            {
              "id": "criterion-14",
              "met": null,
              "evidenceUrl": null
            }
          ]
        }
      }
    },
    {
      "id": "aether-runtime-os",
      "name": "Aether Runtime OS",
      "visibility": "public",
      "kind": "original",
      "family": "chimera-evidence-runtime",
      "status": "research",
      "featured": false,
      "order": 3,
      "description": {
        "en": "Multi-process Aether runtime research generation focused on recovery, signed evidence, WAL-backed persistence, and deterministic replay.",
        "fa": "نسل پژوهشیِ چندفرایندی برای بازیابی اجرا، شواهد امضاشده، ماندگاری داده و بازپخش قطعی."
      },
      "scope": {
        "summary": {
          "en": "Multi-process Aether runtime research generation focused on recovery, signed evidence, WAL-backed persistence, and deterministic replay.",
          "fa": "توالی زمانی مخزن‌ها به‌تنهایی نشان نمی‌دهد این پایگاه کد پیش از محیط اجرای کنونی ساخته شده باشد."
        },
        "limits": {
          "en": [
            "repository chronology does not establish that this codebase predates aether-runtime",
            "runtime/replay evidence is not a formal correctness proof"
          ],
          "fa": [
            "تاریخچهٔ مخزن به‌تنهایی تقدم زمانی این پایگاه کد را ثابت نمی‌کند.",
            "شواهد اجرا و بازپخش، اثبات صوریِ درستی نیستند."
          ]
        }
      },
      "stack": [
        "GitHub Actions",
        "Rust",
        "Rust/Cargo"
      ],
      "languages": [
        "Rust"
      ],
      "links": {
        "source": "https://github.com/aixaria0/Aether-Runtime-OS",
        "live": null,
        "docs": null,
        "evidence": null
      },
      "metrics": {
        "commits": 5,
        "prs": 0,
        "mergedPrs": 0,
        "ciRuns": 7,
        "evidence": {
          "score": 5,
          "criteria": [
            {
              "id": "criterion-01",
              "met": null,
              "evidenceUrl": null
            },
            {
              "id": "criterion-02",
              "met": null,
              "evidenceUrl": null
            },
            {
              "id": "criterion-03",
              "met": null,
              "evidenceUrl": null
            },
            {
              "id": "criterion-04",
              "met": null,
              "evidenceUrl": null
            },
            {
              "id": "criterion-05",
              "met": null,
              "evidenceUrl": null
            },
            {
              "id": "criterion-06",
              "met": null,